[
  { "id":"it_grandma_amulet","名":"奶奶的幸運符項鍊","來源":"奶奶臨終前交付","用途":["安撫","請託","喚醒"],"鉤子":"可將煞氣自沸降為濁，或讓失我靈短暫回神" },
  { "id":"it_wang_beads","名":"王嬸每日持念的佛珠","來源":"王嬸託付","用途":["安撫","作證"],"鉤子":"對王阿姨與鄰里相關個案特別有效" },

  { "id":"it_heart_sutra","名":"叔叔床頭的般若心經","來源":"叔叔的枕邊經書","用途":["安撫","請託"],"鉤子":"可解鎮驚、平緩自責型執念" },
  { "id":"it_lotus_lamp","名":"蓮花燈","來源":"廟埕點燈","用途":["請託"],"鉤子":"在場域擺放可視為請託開始" },
  { "id":"it_cup_water","名":"一杯清水","來源":"自家灶間","用途":["安撫","請託"],"鉤子":"口乾型記憶時有效" },

  { "id":"it_old_roster_page","名":"舊名冊頁","來源":"碼頭倉房夾層","用途":["作證"],"鉤子":"可矯正名字、證明身分" },
  { "id":"it_red_cloth","名":"土地公紅布","來源":"土地公廟","用途":["請託"],"鉤子":"作為你有門路的象徵，提升人情可信度" },
  { "id":"it_three_coppers","名":"銅板三枚","來源":"抽屜底","用途":["請託"],"鉤子":"壓紙、非占卜，用於「置石為證」類請託" },

  { "id":"it_camphor_chip","名":"檜木片","來源":"老房樑掉下的一角","用途":["喚醒","安撫"],"鉤子":"坑木氣味能喚回礦坑相關回憶" },
  { "id":"it_incense_paper","名":"紙錢一束","來源":"雜貨店採買","用途":["請託"],"鉤子":"在重要分離瞬間焚化，作為告別" },
  { "id":"it_old_photo","名":"舊家照片","來源":"祖厝抽屜","用途":["作證","安撫"],"鉤子":"讓亡魂確認牽掛之人" },
  { "id":"it_hot_rice","名":"一碗熱飯","來源":"廚下新蒸","用途":["作證","請託"],"鉤子":"替代塑膠供品用，需現場擺上方算數" }
]
